,Text,enc_label
3130,అవినీతి రహిత పరిపాలన గనక ఇస్తే తప్పకుండా రాష్ట్రం అభివృద్ధి చెందుతుంది,1
3131,అబ్బాయిలకు షాక్ ఇచ్చేవారు వుంటారుఇప్పుడు అమ్మాయి కే షాక్ ఇచ్చాడు,1
3132,ఆమ్మో పాపా చాలా స్పీడ్ మీద ఉంది కుర్రాళ్లకు పోయేకాలం వచ్చింది,1
3133,e rojullo ela chetta dress lu dancelu vesi paruvu theyyakamdi mam,0
3134,టీడీపీ కార్యకర్తలు అందరూ మన ఈ ఛానెల్ ను Subscribe చెయ్యండి,1
3135,ఇలాంటివి చేస్తేనే మీకు 2019 లో బొక్క పడింది,0
3136,చంద్రబాబు నాయుడు సరిపోతుంది,0
3137,అంటే జగన్ కు భయపడుతూనే ఉంటారు,0
3138,ఎలాంటి అన్నీ వీడియోలు చేసిన కాగన్ ఇకా కూడా పికలేరు,0
3139,ఆల్రెడీ మీ మీద మీకే డౌట్ వచ్చేసింది,0
3140,అయ్య ఇది ఎవరు ఎడిట్ చేశారో వాళ్లకు నా నమస్కారాలు రేపు జరగబోయే ది కరెక్ట్ గా చూపించారు,1
3141,బిల్డప్ బాబాయ్ వచ్చాడు,0
3142,నేను మెగా ఫ్యామిలీ అభిమానినీ ఎందుకో గాని అల్లు అర్జున్ అంటే నచ్చదు,0
3143,అన్న నువ్వ చాలా బాగా చేసావు,1
3144,మీ ఇద్దరి కామెన్షన్ సూపర్ అన్నా,1
3145,జీవితాంతం గాలికే వదిలేస్తారు,0
3146,నీటి యువతను పాడు చేసేవి ఇలాంటివే,0
3147,ఇదంతా ఎందుకని మా ఇంట్లో ఛానెల్స్ లేకుండా చేసాం,0
3148,నేనైతే ముందే ఛానల్ మార్చేస్తా,1
3149,మన దేశంలో దున్న పోతును మేపినట్లు మేపి బెయిల్ మీద బయటకు తీసుకు వస్తారు,0
3150,యశోద మూవీ చాలా బాగా ఉంది,1
3151,Hit Kodithe kadhu madam valla tho padukunte offers vasthai vallaku,0
3152,Exposing dose penchhite offer lu vasaty,0
3153,అఖిల్ అయ్యగారే కరెక్టు…,1
3154,Frank ga cheppalante evari personal life valladiMeru chesthundi enti mariPeruki pedda news channels Avasaramayina news vadilesi sodhi news lu cheppatleApudu mimmalni alage anali gaEnta sepu cinema valla personals lo leda social media peru cheppiNetizenlu troll chesthunaru anatam Controversy lani pani kattukuni crete cheytamila sodhi news ee kani paniki vachevi epudyna cheppara raScrap media channels,0
3155,Nee bonda pelli ayyaka vidipovatam kante munde vidipovatam manchidi nuvvu nee dikkumaalina news,0
3156,సిద్దార్థ్ రెడ్డి గారి మాట్లాడే విధానం నాకు చాలా ఇష్టం,1
3157,దాదాపు 3 సంవత్సరాల నుండి ఎదురు చూస్తున్న నేను బైరెడ్డి సిద్దార్థ రెడ్డి అన్న ఇంటర్వ్యూ కోసం,1
3158,మొత్తం చూసా నిజాయతీ గా వున్నాయి ప్రశ్నలు జవాబులుసూపర్ బై రెడ్డి సిద్దార్థ్ రెడ్డి,1
3159,సిద్దార్థ్ రెడ్డి అన్న లాంటి నాయకులు ఈ సమాజానికి చాలా అవసరం ఉంది,1
3160,సిద్దార్థ్ రెడ్డి అన్న మాట్లాడితే పులి పంజా విసిరింట్టు ఉంటుంది జై సిద్దార్థ్ రెడ్డి అన్న,1
3161,ఓన్లీ బై రెడ్డి సిద్ధార్థ రెడ్డి అన్నయ్య కోసం చూసినవాళ్లు like me,1
3162,బైరెడ్డి సిద్ధార్థ రెడ్డి కి మంచి రాజకీయ భవిష్యత్తు ఉంది,1
3163,నా లైఫ్ లో ఒక నిజాయతీగా సాగిన ఇంటర్వ్యూ చూసా జై బైరెడ్డి సిద్దార్థరెడ్డి గారు,1
3164,ఒక చిన్న పాపను పెంచుతున్నారు మీకు మనస్సుకు శతకోటి వందనాలు గణేష్ గారు,1
3165,Hero లని చూసి herione ల ని చూసి మురాసిపోయే కన్నా బండ్ల గణేష్ సర్ interview చుస్తే ఒక మంచి positive vibration వస్తుంది కష్టం అనే పదానికి అర్థం నీవు సర్ అందరూ comdieons ఉన్నారు కానీ మీరు life లో king సర్ Love u Sir Love you forever Sir,1
3166,ఒకరికి జీవితం ఇవ్వడం అన్నిటికన్నా ఎంతో గొప్ప విషయం Tq bandla ganesh garu,1
3167,నాగరాజు దూల తీర్చిన గణేష్ గారికి నా హృదయపూర్వక ధన్యవాదాలు,1
3168,ఆంధ్రప్రదేశ్ ఇసుక మాఫియా డాన్ జగ్గు భాయ్,0
3169,ఓరిని నెరేషన్ తగలెయ్య రాజీవ్ గాడ్ని మించిపోయావ్క సూపర్ జి edava,0
3170,ఆంధ్రప్రదేశ్ కొండలు గుట్టలు కబ్జా మాఫియా డాన్ జగ్గు భాయ్,0
3171,మూర్తి గారు మీకు ఉన్నబాధ అందరికీ అర్థమయ్యేతే బాగుండును,1
3172,ఆణిముత్యం అన్న నువ్వు ఎన్ని సార్లు చుసిన బోర్ కొట్టట్లే అస్సలు,1
3173,నాకు ఇంటర్నెట్ మొబైల్ డేటా లేదు అండి ఇందులోనుంచి డబ్బులు వస్తే ఏపించుకుందాం అని చూస్తున్న మాములుగా లేదు అనుదీప్ గారి పంచెస్,1
3174,Meru super mee matala chala chala navu vastundi sir,1
3175,Director ga kante camedian ga akkuvaga navvistunnaru super,1
3176,ఈ సినిమా మంచి విజయం సాధించాలని కోరుకుంటున్నాను,1
3177,నచ్చావురా నిజాన్ని నిర్భయంగా బాహాటంగా చెప్పగలిగిన నీ వ్యక్తిత్వానికి,1
3178,ఇది ఆ ఏరియాలో చిరు అండ్ జనసేన ఓట్లకోసం ఈ స్టంట్ erri pu gadu,0
3179,సర్ goodmng ధర్మవరం నేను ప్రతి ఎపిసోడ్ చూస్తా మీలాంటి వాళ్ళు చాలా అరుదు,1
3180,India లో పుట్టినందుకు చాలా సంతోషంగా గర్వాంగా ఉంది Atleast మనకి ఇక్కడ freedom ఉంది ఆడవాళ్ళకి,1
3181,గర్వాంగా ఉంది అన్వేష్ నువ్ మన భారతియుడు అయినందుకు శభాష్ తొడకొట్టి చెపుతున్న ఇండియా లో పుట్టటం ఎన్నో జన్మల పుణ్యం,1
3182,ప్రజలు తప్పకుండా మంచి చెడు గ్రహించి చదువుకున్నవారు ఇట్లాంటి విషయాలు తెలియని వాళ్ళకి తెలియచేసి రాబోయే రోజుల్లో విజ్ఞతతో ఓట్ వేసి ప్రజాస్వామ్యం ని కాపాడాలి అని మనవి…,1
3183,మీరు మీ లాంటి వారు రాష్ట్ర నికి చాలా అవసరం,1
3184,Vaadi face enti ala aypothundi chiraku ga,0
3185,Janaalu navutunaru Nani asalu siggu eggu lekunda elaa support cheskuntunnav,0
3186,Ree babu Nani GA neku eaduku Ra avasaram vajaya Sai chappali ha visayam nevu eaduku neku avasaram eamiti,0
3187,Veedu bhutulu vedava,0
3188,24 hours TDP adhi chesindhi Janasena idhi chesindhi YSRCP EM PEEKINDHI RAAAAA lafoot all fraud all kabja all fake YSRCP life lo malli gelavadhu…,0
3189,Yerri paapalam manam samanya prajalu,0
3190,Meeru Gopi Goda meeda pilli anna maata edava,0
3191,Party paranga vaduu Godameeda pilli laga kuda vaddu ra howla,0
3192,No1 broker raa nuvvu,0
3193,Ithea meeru yemi chei leru Ani opukunaru santosam ithea meeru cheappe sollu ennalu vinnandhuku memu sannasulam kaani memu 2024 lo maa vote tho cheigalam,0
3194,Dasamagram Datha Puthrudu Gali Pavan puka ga Namakaranam cheyyadi,0
3195,Elagaina vastadu mee dhulaa thirustadu,0
3196,Induke mimmalni YCHEEPI chavata sannasulu andi,0
3197,Mere brathukulu inthey eka Nasanayam aaipotai,0
3198,Miru Theda ga kanipisthunnaru,0
3199,YCHEEPI goondalaki Bhayam start ayyindi edavalu ki,0
3200,Cinema shuting ku అవసరం అనుకుంటాఅందులో సీన్ కోసం ఇలా చేసినాడు కారు మీద పనుకోవడం overaction erri p gadu,0
3201,Maku commen sense undaa banda edava anni ardam avthunai miku ardam avudi election ina tharwatha,0
3202,E Andhra Thanos and Paytm batch picheakki elanti panulu cheastunarru Poea kalamm dagera padindi,0
3203,Shooting leka mind dobbindi court should consider this issue if students take him as inspiration then what will happen Is it correct pls consider it,0
3204,Hello paytm s meeeku okkadi paguluddi,0
3205,Konderri puk channel la unde,0
3206,పోయేకాలం దగ్గరికి వస్తే అలాగే మాట్లాడుతారు మాట్లాడండి,0
3207,ayya ikkadiki vochi 5rs tiskuni moragandi inka,0
3208,Pora neeeeeee nekanna pedha vunmadhi vuntara ambati,0
3209,ఇలాంటి పిచ్చి పట్టిన వాళ్ళ గురించి మాట్లాడటం ఎందుకు అంబటి గారువదిలేయండి,0
3210,elangana prabhuthvam Andhuna POINT KALYAN vaadi AMMA ni DHENGINA prabhuthvam kadha No doubt,0
3211,Car top medhega kurchuni vachindhi mee araganta auntymedha kurchuni kaadhu ga me fans tega feel aypothu support chestnaaru manchi aatagaadivey,0
3212,మార్రి తామారు ఎవర్రి తోకను పాట్టుకున్నారు మాహాసేయా అబట్టి,0
3213,Meeru ilaage sakshi munde vuntaaru okasari bayatiki velthe nee bathuku yento prajalu telustaaaru velli chudu,0
3214,Pichi pattinattundi peekey ki A P arachekam jaragabothundhi ani anipistundhi naku,0
3215,Vaadi puttuka lopam,0
3216,Ee gali gadu UgipotunnaduCinma shooting anukunnademo,0
3217,శనివారం నాడు శని గాడు వచ్చాడు మన రాష్ట్రానికి,0
3218,Konchum Theda kadu chala Theda After 2024 elections 25 paise direct flight to Moscow Russia to become President of Russia Package changed from Rs 250 cr to Rs 1000 cr,0
3219,Pichi kukka tho pillasainiks jai Paytm pillasainiks,0
3220,Siguu vundali mokaniki laa,0
3221,Siggu undali ra,0
3222,Nuvvu vastavu em matladathavo nekay theledhu tedha ga,0
3223,Neevi pichi kekalu,0
3224,Nuv pani cheira babu mundu eppudu vere malla meda padi edustav,0
3225,Babu aambotu ramubabu garu maru matladevi enti ainaa meekanna unmadulu evarunnaru netho padhi mandi daka untaru malli chupinchu antaru enti,0
3226,Sir paapam taagivachaduthagubhothoduvadhileyandi sirsir ma galli lo oka drinker same to same pk laagane vunttaduvaadu vaadi cuttingthu,0
3227,Pawala Pichi KukkaBiscuits kosam vachindoiiii,0
3228,Nuv matladina waste ra,0
3229,nikanna kukkaha leru,0
3230,Apara thagubothu abbati,0
3231,Sulli ra,0
3232,Nuve tedaga mataladutunav,0
3233,Babu o rambabu nuve sa Naki pothuv babu,0
3234,అందరికీ అర్థమయ్యే భాషలో చాలా బాగా మాట్లాడారు సర్,1
3235,Mee maata tiru chala baguntadi si,1
3236,సూపర్ సార్ మీరు చాలా బాగా మాట్లాడారు సార్,1
3237,మధుసూదన్ అన్న అసెంబ్లీలో అయినా బయట అయినా మీ స్పీచ్ కి మేము ఎప్పటికీ అభిమానులమే,1
3238,సింహం నిద్ర లేచింది ఒక్కొక్కడికి ఒక్కొక్కడికి జోలపాడలేవు,1
3239,Atla vuntadi mala manathoni mamula undadhu,1
3240,సూపర్ మేడం బాగా చెప్పారు,1
3241,రోజా చాలా తప్పు చేసింది ఇంకా చేస్తుంది,1
3242,మేడమ్ మీలాంటి వారు ఈ సొసైటీకి కావాలి,1
3243,నిజం నిర్భయంగా అడిగారు మేడం థాంక్యూ మేడం మహా న్యూస్ మేడం గారికి ధన్యవాదాలు,1
3244,తట్టా బుట్టా సర్దుకొని రెడీ గుండు జగన్ రెడ్డి టైం అయిపోయింది,0
3245,ఎవరు ఏమి కుంటా పనిని ఏమిచేయాలేరు మన నాయుకుడు ఁపజలమంచికోరి వాడు అందుకు దేవుడు తోడుంటాడు,1
3246,entha cute couple abbaa,1
3247,Akkka this is just na birthday akka ninna and this video makes me laugh little harder u guys are best,1
3248,Meeru nijamga made for each other Asalu mi vlogs vammo navvi navvi na kallalo nunchi water ochesindhi hope you will do more and more videos,1
3249,Geethu first navu over action vadu ok ah pubic ke over action vadu ok navu Koda same,0
3250,Peetha … idokA Lavada lo buildup,0
3251,ఇపుడు కూడ తన తప్పులు ఒప్పుకోవటం లేదు pichi munda,0
3252,Geethakka performance matram apadam ledhu gamental di,0
3253,Geethu ki correct mogudu Shiva dimma thirigindi geethu ki,0
3254,Next faima ఈ పొజిషన్ లోకి రావాలి సపోర్ట్ లేకుండా గేమ్ ఆడట్లేదు Worst గా behave చేస్తుంది,0
3255,Next faima ఈ పొజిషన్ లోకి రావాలి సపోర్ట్ లేకుండా గేమ్ ఆడట్లేదు Worst గా behave చేస్తుంది aha erri puku di,0
3256,గిన్నెలు నేను ఎప్పుడు కడగలేదు అన్నప్పుడు viవీడియో ప్లే చేసినప్పుడు గీతూ మొహం చూడాలి kothi la pettindi moham,0
3257,Geethu ni frist eleminate cheyyandi mari ante Mari chesthundhi edhi pedha over action toy aeindhi ra babu,0
3258,Satya over action ekuva aindhi arjun paina Papam vadi affection kuda content laga thisukundhi,0
3259,Ammai Maya la padithy Ela madhyala out aavtham papam bali aaipoyadu pilla puku gadu,0
3260,Mustache kosam wait chesi untaduinni rojulu ee video cheyadanikienthaina ne dedication ki hats off bro,1
3261,తమరు చెప్పింది కరెక్ట్ గా పాటిస్తే ఏ సమస్యలు ఉండవుఅన్నగారు బాగా చెప్పారు కేతిరెడ్డి అన్నగారు,1
3262,అబ్బా చాలా హుందాగా చెప్పారు సార్ మిత్రులారా మాట్లాడే విధానంలో మన కొడాలి కన్నా బెస్ట్ కదా…,1
3263,బౌలింగ్ వరస్ట్ ఇండియన్ టీమ్ ది,0
3264,ఫైనల్ ఇంగ్లాండ్ గెలవాలి ఆల్ ది బెస్ట్ ఇంగ్లాండ్ టీమ్ 2022 ఇంగ్లాండ్ విన్నర్,1
3265,Cup పాకిస్థాన్ దే అదృష్టం కలిసి వచ్చింది All the best పాకిస్థాన్,1
3266,England match gelichindi viratsky and hardik hrudayalu gelicharu anthe,1
3267,Ipl ki best mana palyers international matches enduku waste,0
3268,Kanisam okka wicket kooda teeyaledu waste galu,0
3269,మేడం గారు మీరు మాట్లాడింది 100 కరెక్ట్ మేడం గారు హాట్స్ ఆఫ్ టూ యు మేడం గారు,1
3270,విజయ్ దేవరకొండ గురించి చెప్పింది చాలా పర్ఫెక్ట్ గా చెప్పారు మేడమ్,1
3271,ప్రియా గారు మీరు చేసిన కామెంట్ చాలా బాగున్నది ఇలాంటి వారు తెలుసుకోవాలి ధన్య వాదాలు,1
3272,అమ్మ అమ్మ ఏముంది సినిమాలను కన్న ఇదే బాగుంది,1
3273,మంచు కుటుంబం తెలుగు ప్రజకి దేవుడు ఇచ్చిన గొప్ప వరం,1
3274,కామెడీ సింగర్స్ ఈ విధంగా వాళ్లకు ఒక గుర్తింపు వచ్చింది,1
3275,మంచు కుటుంబం తెలుగు ప్రజకి దేవుడు ఇచ్చిన గొప్ప వరంతప్పదు భరించాల్సిందే0,1
3276,Nenu డ్రాయర్ ఎస్త చూడు నేను డ్రాయర్ ఎస్తా చూడు నా డ్రాయర్ siad చూడకుంటే ఇప్పెస్త చూడు,0
3277,అన్నా నిజంగా చాలా రోజుల తర్వాత మనస్ఫూర్తిగా నవ్వుకున్నాను tq anna keep doing like this,1
3278,Anna mee Spandhana bagundhi,1
3279,rashmikaanteasalu chiraku naaku,0
3280,చాలా బాగా చేస్తారు మీరు అభిమాని అయిపోయాను మీకు,1
3281,Saami Kadha kannaa venakaala nuvv cheppina vivarana baagundi…,1
3282,ఆయన గొప్పవాడని పొగిడినప్పుడు ఆయన లాగానే మీరు కూడా ఉండాలి కదా,1
3283,RGV effect valla Puri cinemalu anni dobbayi,0
3284,vadu donga nuuv yadava,0
3285,Psycho pastor vadulu,0
3286,RGV tharuvathe evarainaRGV is greater than Rajamouli or anyone else,1
3287,Vine vallani batti cheppochu RGV ki entha respect istharo vallu,1
3288,Swaami nee attitude ardham chesukune maturity ee world ki Inka raledhumay be after 20 years we may get that maturity really you are amazing…,1
3289,Ne failures ni kuda honest ga accept chesthav andhuke nuv Greatnormal human being ki adhi kudharadhu,1
3290,Meeru nijanga great sir RGV is very great,1
3291,Upendra cinema lo hero character RGV Real Character Same to same,1
3292,Pakka salaar release 28 sep key prashant neel ss Rajamouli RRR key bayapadaley viniki bayapadutada na lowda,0
3293,జీవా ఓ విలక్షణమైన నటుడుసీరియస్ ఫ్యూరియస్ పాత్రలే కాక కామెడీని కూడా నూటికి నూరుపాళ్లూ పండించగల అద్భుతనటుడు,1
3294,ఇలాంటి నటుడు మళ్లీ పుట్టాడు తెలుగు ఇండస్ట్రీకి దొరికిన ఆణిముత్యం మా జీవ సార్,1
3295,తెలుగు పరిశ్రమకు ఉన్న మంచి నటుల్లో జీవా గారు ఒకరు,1
3296,మీ anckaring సూపర్,1
3297,ఇదొక ఇంటర్వ్యూ నా waste interview,0
3298,హోం వర్క్ చాలా బాగుంది,1
3299,కూటి కోసం కోటి విద్యలు,1
3300,Sound thaginchi chudala Thu dinamma yemundhira dintlo lanja la undi,0
3301,దిక్కు మాలిన హెడ్డింగ్ లు వెదవ స్టోరీలు,0
3302,Koja valla number untyy send me,0
3303,స్త్రీలను వీధిలోకి లగకంది పవన్ గారు చూస్తే ఆయనకి పార్టీ కి చెడ్డ పేరు వస్తుంది,1
3304,అన్నా నువు ముడ్డి కడుక్కోకుఆ నీళ్లు వృథా కావుపొలాలకి నీటి కరువు వుండదు,0
3305,తెలివిగలవాళ్లని అనుకుంటాంగానీ కాదు అదృష్టం ఏమూలో ఏడుస్తుంది ఇట్లాంటి వాళ్ళకి జనాలతో తిట్టించుకుంటే కాని నిద్ర పట్టదు,0
3306,Number cheppakunda recharge super ga chesav,1
3307,Nuvu nijangane pichodivi,0
3308,తొమ్మిది నిమిషాల వీడియో లో 900 కామెడీ సూపర్ బ్రో నీవు…,1
3309,అంతరించి పోతున్న ఆరోగ్యావంతమైన హాస్యాన్ని తట్టి లేపిన సాత్విక్,1
3310,కాదన్నా నవ్వి నవ్వి చచ్చిపోతే ఎవరు రెస్పాన్సిబిలిటీ అన్నా సూపర్ అన్న,1
3311,Prathi scene prathi shot u mind pothundhi Amma baboy Awesome script selection,1
3312,ఈ వీడియో తరువాత నేను నుకు పెద్ద అభిమాని అయ్యాను బ్రో సుపుర్,1
3313,సూపర్ బ్రదర్ కామెడీ కేక్క 1000 కామెడీ వీడియో,1
3314,నువ్వు మా పాలిట దేవుడు అన్న,1
3315,Annaaaa navvii navvvii stomach pain vachindhi,1
3316,Chala bagundhi anna,1
3317,సూపర్ అన్న నీ వీడియోస్ నీ మాటలు అంటే నాకు చాలా ఇష్టం అందుకే నీ ఛానల్ సబ్స్క్రైబ్,1
3318,తెలంగాణ జాతి రత్నాలు మనోళ్లు,1
3319,veedu em chestunadu ra ante I want to understand his state of mind kantlo neellochinay navvi navvi devudaa,1
3320,కెజియఫ్ మనిషి ఒంటరివాడైనా ధైర్యంగా పరిస్థితులతో పోరాడి బతకగలిగేంత ధైర్యం ఇచ్చే సినిమాకాంతారా మనిషి ధైర్యవంతుడు అందరూ ఉన్నవాడైనా మూఢనమ్మకాల పేరుతో మనిషిలో ఉన్న ధైర్యాన్ని నాశనం చేసే సినిమా,1
3321,హలో మేడం ఉపేంద్ర ని తక్కువగా చెయ్యకు నీ న్యూస్ చెప్పుకోledha davada pagalipotundi,0
3322,పాన్ ఇండియా రెడీగా ఉండు 2023లో టైగర్ ఎన్టీఆర్ Anna వస్తున్నాడు,1
3323,ఎక్కసాక్క పాపకి మాత్రం రెండు ఒకేసారి పెట్టాలి puku lo మంచి కసి మీద వుంది,0
3324,ప్రతి సీన్ ప్రతీ షాట్మతి పోతుంది లోపల awesome,1
3325,లాస్ట్ లో సాంగ్ ఎంత మంది మిస్ అయ్యారు బ్రో,1
3326,Madya madyalo aha sound vere levelEe aunty ekkada dorikindi bro vadaletldugaGap ekkuvindi bro,1
3327,Vaanchi Padidhengu broo,0
3328,బ్రో వచ్చావా ఈరోజు కూడా రాకుంటే పేపర్లో వేపిద్దం అనుకుంటా వుంటి,1
3329,Enni rojulu ayindi anna ne video chusi,1
3330,దాన్ని పేరు ఏంటి ఐడి ఏంటి చపూ బ్రదర్,1
3331,దానంలో కర్ణుడికి కజిన్ లా నటనలో కమలహాసన్ ను మించిపోయేలా,1
3332,Return lo bocha nuvvu theeskoni unte super laughter vachedhi bro,1
