,Text,enc_label
1544,Village పిల్ల నీవు super,1
1545,Village piilla super,1
1546,Eddaru super,1
1547,ఇద్దరు సూపర్ గా చేసారు,1
1548,సూపర్ వీడియో తీసుకున్న భయ్యా,1
1549,City akka Bala vastaaru akka miru mi out fit super ga akka love you so much akka,1
1550,Green dress sis super ga chesaru,1
1551,Village ammayi super,1
1552,City akka supper,1
1553,Ya meru cheyagalaru Jai janasena,1
1554,Correct ga chepparu sir next time Meru cm kavali,1
1555,Kulam ane godala meedha ye system nilapadadhu,1
1556,Pichi hospital lo join avara ayomayam,0
1557,Malli Kapu Card Pattukunnav Kada,0
1558,Me kastam palinchali sir,1
1559,Padavi kulaniki kaadhu sir Capability and charector unna manishiki Stop talking about caste,1
1560,OK mari maa sc cast ki esthava siggu undali,0
1561,Kulam gurinchi matladakunda eeyana meeting complete avvadu,0
1562,Bongemi kaadu muyyara salu puka,0
1563,Ayya kulaala gajji vadhulu nee STRAATAJI baaga ledhu nuvv saadhinchalev,0
1564,KALYAN RAM GARIDI cinemalo ONE MAN SHO,1
1565,Movie superb Malli malli chudalanipstundhiiii super super super,1
1566,Movie aithe chaala ante chaala bagundi part 2 kooda twaraga vachi gana vijayam sadinchali thank you Kalyan ram garu and vassishta garu chaala baaga thisaru ituvanti kotha kotha movies Inka yenno cheyyalani manaspurthiga korukuntunnanu,1
1567,Cinema motham super andulo ee scene inka highlight,1
1568,Wow charan very handsomechala slim ga vunnav Bhale muddhu vasthunnavmaa chiru anna kodukuAnte naku chala istam,1
1569,Koncham over action ekkuva undi ra anu deep needi,0
1570,Over action chayakandi ra pal laga migilipotaru,0
1571,Mi over action meru,0
1572,Eddari avataralu bale unnai ra baffun la,0
1573,Asallu emi undi ra swamy jathi rathnallu sollu Comedy Malli part two ante anthe KathaJanelle chachipotharu,0
1574,Ggajuwaka pilla memu gajulollam kadaSuper performance all the best,1
1575,Aa paata rojula record dance malla start ittayi,1
1576,Super Madam dance chala bagavesaru,1
1577,Avnu nenu mimmalni chusanu chaala sarl,1
1578,Nv chala mandhi ki inspirational eppudu,1
1579,నైస్ సిస్టర్ దేవుడు ఆశీస్సులు నీకు ఎప్పుడు ఉండాలని కోరుకుంటూ మీ chell ని,1
1580,సూపర్ అమ్మ మన వూరు పేరు తెచ్చావు,1
1581,నువ్ హీరో అవతావు అన్న అంత స్టయిల్ వుంది నిలో ఇది రియల్ మాట,1
1582,హీరో మెటీరియల్ జానీ అన్న నువ్వు,1
1583,నిను చూస్తుంటే KGF సినిమాలో RACKY బాయ్ గుర్తుకు వస్తున్నాడు,1
1584,బయటకు గేంటేసారు ఒక్కసారి లైవ్ ప్రోగ్రాం నుండి అంతే పాస్ట్ గా పైకి లేచాడు చూపించావు ఓటమి లో కూడా ఎలా పైకి రావాలో అని,1
1585,Johnny master a movie choreography chesthe aa movie lo signature step pan India avalsindhi,1
1586,Vere level lo undhi performance looking very handsome,1
1587,Kgf chapter 1 ఫ్లెక్స్ చూసి జాని మాస్టర్ అనుకున్న ఫస్ట్ యాష్ రామ్ చరణ్ జాని ఒకలాగే ఉంటారు,1
1588,Bass jaani sir nuvvu e song ki cheyyaka pothe waste e song,0
1589,చాలా కష్టపడి ఈ స్టేజి కి వచ్చడు,1
1590,nuvvu thopu raaaaaa bhai,1
1591,jani anna RC annatho kalisi hero ga cheste choodaalani vundhi,1
1592,Style ga unav anna,1
1593,Neelaga andaru Allo chinchali anna,1
1594,అన్నా నువ్వు పెద్దగా మీ తాతలా ఎదగాలి అంటే నువ్వు పక్కా జెనసేనలో చేరు అవ్వు అన్నా ప్లీజ్ నాకు తెలిసి నువ్వు రాయలసీమ నుండి పెద్ద నాయకుడు అవుతావ్ కానీ జగన్ నిన్ను ఒక చదరంగం లో సిపాయి లా,1
1595,Anna nv janasena lo join antha AP lo Next level untad,1
1596,Devududevudini chudafaaniki enduku raaraiah,1
1597,Craze aa nijaythi undi anna adi telusukuni matladu anna,0
1598,Ycp lo meeru emi cheyaleruJsp lo neeku nachhinattu vundavachhu,1
1599,Nuvvu JENASENA lo cherali bro,1
1600,Sudheer ni timingi timing anna,1
1601,Twaralo telugollanta pichollawutaaru,0
1602,Sudder jafaa,0
1603,E lavadalo jokulu Kampu chesaru kada ra youth ni,0
1604,Comedian ante HYPER ADHI la vundaali Suddheer gaadu same joke prathi program lo vaaduthaadu veedu assalu comedian kaadhu,0
1605,Verry pappa akhil,0
1606,నాని మీలో సూర్య పోలికలు కనిపిస్తున్నాయి So nice of you,1
1607,Nakenti bhayya nazriya matladthunte manchu akka matladthunattundi,1
1608,Chala ibandi pettavu anna Nuvvu maa Chiru garini,0
1609,Sorry to say but chinna events ki velthe ilaney jarugutundi,0
1610,Arey Babu Memu chinnappati nunchi chiru fans pls dont hurt us first chiru next evarina maaku,1
1611,Eee generation ki…Mee value telidhu Sir…,1
1612,Areyy vanni mental hospital loo join cheyyadraaa,0
1613,Naku boothulu vasthunnay chiranjeevi anthati vyakthine vere vallaa laga imitate cheyyamantunav n,0
1614,Banisa La unnaru kadara meeru me overacting,0
1615,Edo audio function ki vacha kadha extralu chaste kaya kosta,0
1616,Mee movie hit avvadam chala happy gaa vundhi sir all the best kalyan ram garu,1
1617,హీరోయిన్ vere vallani తీసుకుంటే baagundedhi,1
1618,Anna prabhas annani Amina ante assalu baagodu,0
1619,Dongathananga kaadhu anna paisal bengi ichhindi ala cheppandi,0
1620,కోడెల శివప్రసాద్ అందుకే రా నువ్వు తొందరగా తెచ్చావ్,0
1621,Assembly lo thittukodanike miru vachedhi,0
1622,చిన్న అవుట్ సోర్సింగ్ ఉద్యోగులం మమ్మల్ని బాధపెడుతున్నావు త్వరలో మీ నాన్న దగ్గరికి వెళ్తావు రా,0
1623,Mi Nanna ni chepinadi nivera,0
1624,మీ నాన్నగారిని కాంగ్రెస్ పార్టీ కాపాడుతూ వచ్చింది,1
1625,Appudu me nanna kapadindu yanni thappulu chasina Ur father knows your character andhuke nuvvante ayanaki estam ledhu,0
1626,మాకు తెలుసు పవన్ అన్న అంటే ఏంటి యావడో మాటలు పట్టించుకోము జై జనసేన,0
1627,Sometimes nuvvu vacchinanduku chala feel avutunna ninnu ilanti position lo vunchina naaa lanti die hard fans ni chustunte anna,1
1628,Ilanti comedy Valle movie flop aindhi,0
1629,Andhuke cinima utterflop aindhi Nithin anna chala careful ga select cheskovali scripts,1
1630,బొక్కలో bekar movie దొబ్బింది,0
1631,I love her voiceNice girl వాగ్దేవీ మేడం so sweet of you,1
1632,Chi pooja Hegde tho polika anti aame kante meere baaguntaaru,1
1633,ఆ పూజ కన్నా ఈ పూజనే బాగుంది,1
1634,Ammai heroine la try chesthe bagundu super undi,1
1635,Beautiful ammai ni pattu konae verae name tho enduku pilustaru,1
1636,Anchor nuvvu super ga vunnavu,1
1637,Vagdhevi nuvvu heroinega prabhas gari tho heroinega cheyyandi superga vuntundhi PRABHA VS VAGDHEVI,1
1638,ప్రతి తండ్రి కోరుకునేది ఇదేజగమెరిగిన సత్యంమీరు సాధించారు అదృష్ట వంతులు మీరు,1
1639,Anna e video 100 sarla chusina thandri kodukulo madhya unna prema super ma dhisti Thaguluthundhi emo bhaya amithundhi,1
1640,Bahusa father and son antey ilagey vundalemo Great father and Good Son,1
1641,Yes annaramcharn great meetharvatha RC okkade,1
1642,MA charan annayya baghunnadhu love you dad,1
1643,Antha Ma Ramcharan annaya manchitanam,1
1644,Goppa vaari kadupulogoppa vaare pudataaruanna maata mea visayam lo corect,1
1645,Andharki daddy laki kodkulu pudtharu kani mega star gariki manchi vaadu puttadu,1
1646,Prabhas antey oka level and oka range,1
1647,Prabhas ki shoulder leg surgery chesaruu then how can he maintain six pack body he also human being I think now recent prabhas pics r good,1
1648,Bahubali time antha Baganey Unnav Anna Tharwatha ee sahoo ki radhe shyam nachinatlu frnds tho sitting uu food padypoyav Anna Ayina sarey darling ee no one,1
1649,ఇష్టం లేని జాబ్ చేస్తునట్టు ఉంది ప్రభాస్ ఫేస్,0
1650,పెళ్లి గాని ప్రసాదు హీరోలల్లా పెళ్లి కానీ హీరో ఎవరంటే అది ప్రభాస్కు మాత్రమే సొంతం,0
1651,Anna plz pellichesuko sir age 43 plz anna,1
1652,Crying kadhu Ekkuva Thagesi vunnadu,0
1653,150 కి పైగా సినిమాలు తీసిన mega కూడా ఒరేయ్ అని fans ని ఎప్పుడు అనలేదు,1
1654,సిగ్గు సరం వున్న వాళ్ళు ఎవరు వీడి సినిమాలకు పొకడదు ఏంట్రా ఆ బాషా,0
1655,అరేయ్ తోనే ఆగలేదు భయ్యా అరేయ్ తరువాత నీయమ్మ ఈ వర్డ్ మిస్ అయ్యావ్,0
1656,Fans ki rowdies anna tagline pettinodu prematho arey anadam tho thappu ledu,1
1657,నీ పని అయిపోయినట్టే రాసి పెట్టుకో,0
1658,Fans ki respect Ivvslira arye ntira,0
1659,arey memu ticket konte ne ra ne chethilo Mike nuvvu nilabade stage,0
1660,Vijay devarakonda is my attitude heroandharu hero lu okalaga unte vijay matram vere laga untadulets support him,1
1661,Rendu cinemala ke kallu nettinekkinay,0
1662,వీటికి బాగా బలిసి కొట్టుకుంటున్నాడు అందుకే లైగర్ సినిమా దొబ్బింది,0
1663,ఇలాంటి వాడికి ఫ్యాన్స్ హ బుద్ధి లేని వ్యధవలు ఉంటారు వాళ్ళు,0
1664,Andhuke dhula Baga thirindhi annaaaa,0
1665,Picha Na Kodaka Vinipisthunda Ra Vijay Ga,0
1666,ఎవడి స్టైల్ వాడిది దేవరకొండ స్టైల్ దేవరకొండ ది అంతే ఇంట్లో తప్పేముంది వినిపిస్తుంది చెప్పనా,1
1667,friendly ga annadu,1
1668,Nilo nachedhi attitude సూపర్ rowdy star,1
1669,Box office Amma mogugu Charan Anna,1
1670,యాక్టర్ మీద ఉన్న గౌరవం,1
1671,Naku chala istam anasuya,1
1672,Epudu Anna video asalu,1
1673,Inkenni rojulu wait cheyali bro,1
1674,ప్రపంచంలో అతిపెద్ద అవినీతి పార్టీ టిఅర్ యస్ కెసిఆర్,0
1675,నీ దిక్కుమాలిన ప్రెస్ మీట్ నీ కున్న ఫ్రస్టేషన్ క్లియర్ గా కనిపిస్తున్నది,0
1676,Kcr katham inka,0
1677,90ml సీఎం నీకు హిందువులు అంటే ఎందుకు అంత చులకన,0
1678,జై జనసేన జై పవన్కళ్యాణ్ జై జనసేన,1
1679,PSPK andarini Encourege chestadujai Janasenani,1
1680,ఆ వెర్రి వెంగళప్ప మొహం ఏందిరా నాయనా,0
1681,వెర్రి వెంగళప్ప మొకం ఇట్లనే ఉంటదేమో ఆ అందానికి ఆ ఫేస్ కట్ కి మనం ఇచ్చే వాల్యూ ఎంతండి,0
1682,cinema industry ka king kalyan Annaya,1
1683,Bajana party gallu kalyan garini vadu kuntunnaru andharu,0
1684,Election time lo ni kallu poyaya,0
1685,Mundhu ne cinema lu chusukora,0
1686,Ituvantivi matlade cinemalu nashanam chesukuntunnav,0
1687,Vadu baney unnadu nuvvu chusko nedi,0
1688,Ede ithey adi RGV nijaallu Baga oppukuntaaru,1
1689,RGV tho antha veasyy kaadu,1
1690,రాంగోపాల్ వర్మ రాంగోపాల్ వర్మ మంచి రసికుడు,1
1691,Frist time chusthunnara rgv okarini ela unnaru ani aduguthe,1
1692,Yadhava ni yadhava laage treat chesthaaaru,0
1693,Maa veedhilo prathi roju chettha theesukelle bandi vasthuni vaallu cheptharu thadi chettha oka vaipu podi chettha oka vaipu veyandi ani Kaani ee chetthani ye vaipu veyyalo cheppaledu,0
1694,Nuvuu edhava sir edhi naa,0
1695,Vedava ki brand ambassador sir miru,0
1696,Harsha inner felling Madhya lo veedu arustunadu,1
1697,ma manasulo feeling mere cheppasaru,1
1698,Enno kullu jokulu chusna bhayya Kani idi peaks,1
1699,Ee styles and mannerisms present andaru vaduthunnaru mana industry lo,1
1700,భజన భజన బ్యాచ్ ఎక్కువ అయిపోయారు పవర్ స్టార్ కి పాపం,0
1701,రకుల్ రావు మీ అయ్య గాడు మీ ఎమ్మెల్యే లకు కలవడానికి పర్మిషన్ ఇవ్వడు కదరాబ్రోకర్ గా,0
1702,మీ అయ్య కూడా అదే గతి పడుతుంది,0
1703,Mee Ayya Farmhouse Unte Mee ML Lu Appudaina Mee Ayyani Chusindra Lolly ga,0
1704,ఆపు రా డ్రామా రావు అన్ని సొల్లు కబుర్లు,0
1705,Naa Sanka Naku mari,0
1706,పొరపాటున మళ్ళీ గానీ రాజశేఖర్ రెడ్డి గారు వస్తె కుర్చీ పొద్దని తీసుకెళ్ళి కూర్చోబెట్టడు,0
1707,అన్నకు అర్థమయింది ఈ పాటకు అందరూ పరుగెత్తి పోతారని,1
1708,Comparison bagundhi kaani result matuki Bigboss result avvakudadhu Blockbuster Hit kottali,1
1709,Alaga pogidikoni seda dengaru andaru,0
1710,అప్పుడే అడుక్కునే స్థితి వస్తేఇంకా ముందు వుంది ముసలి పండుగ,1
1711,Ee vaakhyam RRR lo Ram Charan jail scene dheggara vaadaru,1
1712,మీ లాంటి కార్పొరేట్ సినిమా వాళ్ళుకి ఇలాంటి భగవత్గీత లాంటివి అనవసరం,0
1713,Paytm kukkalu ekkada idi kuda cbn gare plan chesaru antaremooo,0
1714,అమ్మ ఒక రాక్షసుడుని కని మా మీద వదిలేసావు తల్లీ నీకు,0
1715,అధికారం కోసం తల్లిని చెల్లి ని కూడా వాడుకొని వదిలేసాడు జగ్గన్న ఇంకా మనం ఎంత గొర్రెలం కాదా మనం,0
1716,మీరందరూ Ap ని సంకనాకించారు,0
1717,రాష్ట్రాన్ని నకించేసి తల్లి కుతురు సైడ్ అయిపోయారు,0
1718,Andra prajalaku siggu undali sontha amma nu chellini patinchukoleni vadu Meemanli chusukuntadu,0
1719,Nice ga side ayaru mi ru jagon kiladilu,0
1720,Eppudaina mi putra ratnam gurinchi Nijam cheppandi vijayamma gaaru,1
1721,Amma correct Ga cheppaavu mi koduku antha donga ippudaina nammu talli,0
1722,శుక్రవారం శుక్రవారం స్టేషన్ కి వచ్చి సంతకంపెట్టు,1
1723,జై మెగాస్టార్,1
1724,Aat tatha on fire,1
1725,Meeru super sir,1
1726,Jayamu jayamu chandranna jayamu neeku chandranna,1
1727,ఇందుకే 23 వచ్చాయ్… ఇలాగే ఉంటే అవికూడా పోతాయి,0
1728,నువ్వు రెచ్చిపో బాబు నీ వెనకాల మేము ఉన్నాం,1
1729,Ram entra babu intha andamga undau super,1
1730,Lips thin ga unte baguntundi,1
1731,Krithi please nee pallaku clips veyinchuko teeth chala munadariki vachay,0
1732,సుమా గారు మీరు మాములుగా చేసినా చూస్తాం ఓవర్ యాక్షన్ బాగా ఎక్కువ అయ్యింది మీ వల్ల రేటింగ్ రావట్లేదు,0
1733,దీనెమ్మ జీవితం నా చిన్నప్పుడు సంది దీని ఓవర్ యాక్షన్ చూడలేక చీదరి ఐతుండే తూ,0
1734,Suma em maraledu ade over action,0
1735,cinema dobbaka aduku tinnanndi eddaru,0
1736,Rana garu miru chala simply Star,1
1737,మీలాంటి పెద్దల ఆశీర్వాదం ఎప్పుడు మా అన్నకి ఉండాలి,1
1738,okka goppa Director chudadam kantay Adrustam Em vuntundi mi Ashishishulu Tarak sir ki vubdali,1
1739,E paata lo Jr NTR nataniki deshame daasoham ayyindi,1
1740,E okka song tho movie vere level ku velipoindhi,1
1741,కళాతపస్వి గారి ని ఈ బంగారు కొండ యన్ టి ఆర్ తో ఓ సినిమా తీయమని ఎవరైనా చెప్పండి దయచేసి,1
1742,Mee Lantivaalla matalu inspiring ga vuntai…god blessed us with more knowledge by sent people like you,1
1743,Devudu manishi kanna goppa,1
1744,Charan దొరికిపోయిన ప్రతిసారీ ntr ni చూస్తాడు,1
1745,Pitchi pk neeku neemeede nammakam ledhu you only belive NCB,0
1746,Yem matladuthunnav ra Naralu kattai poiniy Neeku lekkalenduku ra ayya Weekend politician,0
1747,Samsaram cheyaganey pillalu puttaru sir Wait for good result,0
1748,పుట్టినరోజు శుభాకాంక్షలు అన్నయ్య,1
1749,మీ వాడు మా వాడు మన అందరివాడైన పవర్ పవన్ కళ్యాణ్ గార్కి జన్మదిన శుభాకాంక్షలు,1
1750,Yendira nayana yitla vundiPower Star actions chusthunte goosebumps vasthunayi India lo All records smash ayyela vunnayi,1
1751,సూపర్ కళ్యాణ్ అన్న చంపేశారు పొండి కేక అంతే,1
1752,Wow super sir e cinema chla pedda vijayam avvli me fans ki panga chesukovali sir hbd sir,1
1753,Adhe better anthe kaani life long savings one day lo waste cheykudadhu lifelong entha karchu avthundho aa oka roje antha karchu pedathaaru chaala mandhi,1
1754,Very గ్రేట్ Very humble,1
1755,Own party ni yem peeekaleka yevadiki ichhhi vaaadi kindha bhanisalaga undatam meee vamsanike,0
1756,Blood breed veru Mental certification kuda,0
1757,Adhoka vamsamveedi dabbalu veedu,0
1758,E family dabba manuko vayya bul bul Chala mandi ki records vunnai edo mi family goppa migitha family Sankara jathi ani anadam comnsence ledhu ani ni certificate chepthundi Mi family lo ntr ela vuntadi kalyan ram nv marav nv manshiva balayavva ani antaru ma side,0
1759,Orey jaffa bul bulgo and buffalo muddilo paduko,0
1760,Mi vamaham mohanbabu vamaham tarvathe ra sollu ga,0
1761,Ore sollu apura,0
1762,నేను ysr జగన్ అభిమానిని వినోద్ రెడ్డి గారు మీరు పార్టీ కోసం పడే కష్టం నచ్చింది కచ్చితంగా మీరు విజయం సాదించాలి అని కోరుకుంటున్నాను,1
1763,జై జనసేన మన పార్టీ గెలవాలని మనస్పూర్తిగా కోరుకుంటున్న,1
1764,Annayya nuvvu sucess ayyalani manasara korukuntunna iam from VIZIANAGARAM,1
1765,All the best annya aaani Hard work apudu ki waste kadhu sir jai janasena,1
1766,Ravaali pavanjai janasena,1
1767,అన్నా కాస్త జాగ్రత్త వాళ్లే అనుకోని లోపల నుండి దేంతోనన్న విసిరేరు కాస్త గ్యాప్ ఇచ్చి పోతండే Love you Anna నీ కష్టం వృధా కాదు,1
1768,Baga kastapadutunnav brother super,1
1769,Daya chesi okka chance evvadi pawan kalyan gaariki am from banglore,1
1770,తండ్రి కొడుకు గురించి చెప్పకపోతే ఎవరు చెప్తారు తప్పు లేదు సహజం పుత్రోత్సాహం తండ్రికి,1
1771,NTR ni cm ga chudalitatayya paruvukosam,1
1772,జై ఎన్టీఆర్ అన్న జై రామ్ చరణ్ అన్న,1
1773,Ntr garu miru chala pedda artist Matldalisochinappuduthagginchi matladandi Adigunapudu odiguntame manchidi,1
1774,Mamauluga undhadhu mari ntr anthe,1
1775,మీ ఫ్యామిలీ లో నాకు నచ్చింది నువ్వు అన్న కరెక్ట్ గా మాట్లాడుతావ్,1
1776,నువ్వొక్కడివే మి ఫ్యామిలీ లో అందరితో కలిసిపోయే గుణం కలిగినవారు brother,1
1777,ఎందుకో నువ్వంటే నాకు eatam అన్నవేదం సినిమా చూసినప్పటి నుండీ decide ayyanu Your my brother,1
1778,Adhi ento nuv wrong family lo unnavu bronee speech lo compulsoryga social responsibility untundhihats off to you,1
1779,బడా బడా డైరెక్టర్స్ అందరూ మనోజ్ అన్నతో సినిమా ఎందుకు తీయరు ఎప్పుడూ మెగా ఫ్యామిలీ ఏనా ఫాలోయింగ్ ఉన్న హీరో లేనా జై మనోజు అన్నా,1
1780,Manoj okkade odd man out in manchi family,0
1781,Manchu family ki inka respect undi ante adi only nee valle manoj anna,1
1782,Manchu family ni nvve kapadali anna,1
1783,Manchu Family Paruvu kapade Manishi Nuvvu Okkade anna,1
1784,Nenu oka NTR fan ga chepthuna heart touchesaru sir mee speech tho hats off sir,1
1785,నేను పవన్ కళ్యాణ్ చెప్పిన తర్వాత మీ సినిమా చూశాను చాలా బాగుంది,1
1786,Manchi cinema ni prathi okkaru aadaristaruall the best nikhil have a bright future,1
1787,Ippati varaku peddha heroes ki chinna actors kaka pattaru Ika nunchi pedda heroes thodalu kottada lu meesaalu meda gokkodalu manesi chinna heroes ki value iche time vachesindhi,1
1788,Samudramlo alalu aagavu Harsha Anna ki anna meeda prema chavadi,1
1789,సముద్రంలో అలలుంటే అందం మా గుండెల్లో హర్ష సాయి అన్న ఉంటే ఆనందం,1
1790,nna nuv chesina help ki vallaku edho oka chinna avasaralaku panikosthundhi harsha sai love you anna,1
1791,ANNA nee voice ante naku chala istam,1
1792,హర్ష నీ మనసులగే నీ రూపం కూడా అందంగా ఉంది,1
1793,Smile chudanidhe venakki thaggavu bro nuvvu,1
1794,హర్ష సాయి ఫ్యాన్స్ ఎంతమంది ఉన్నారుఇక్కడ A man with golden heart,1
1795,Vinayaka chavithi subhakanshalu Harsha sai,1
1796,Harsha anna ni kalavaali okkasaraina,1
1797,మీలాంటి వాళ్ళని దేవుడు చల్లగా చూడాలని సార్ హర్ష సాయి అన్న,1
1798,Hi harshahappy vinayaka chavithi life long nuv happy ga undalaniaa devunni korukuntunna saimay god bless u harsha,1
1799,Hii Bagunnara Harsha Sai garu meku Mee team members ki happy vinayaka chavithi,1
1800,Jai Prabhas Anna ఆరడుగుల ఒక మంచి మనిషి,1
1801,సంతోష్ శోభన్ మంచి యాక్టర్ కళ అనేది ఒక ప్రాంతానికి పరిమితం కాదువిశ్వవ్యాప్తమైంది,1
1802,పోలీసోల్లొచ్చి ‍యేటుకు బట్టుకుంటారు,1
1803,Chiranjeevi be like arey em matladuthunnavra,1
1804,KCR డైరెక్ట్ గా ప్రణబ్ ముఖర్జీ కాళ్లు మొక్కీ నప్పుడు ఏమైoది,1
1805,Evari Cheppulu moyataniki prajalu ninnu gelipinchaledu Bandi,0
1806,అక్కడవరకు వెళ్లినవాడు చెప్పులు వేసుకుంటాడు కదా వీడి ఓవర్ యాక్షన్,1
1807,ముందు కళ్ళు తరువాత రాళ్లు తెలివి ఉన్న వారు చేసే పని ఇతరులతో మరియాదగా ఉండాలి మరి బానిసల కాదు,1
1808,అన్న మంచి పని చేసావ్ ఓకే కానీ జన్మనిచ్చిన అమ్మ నాన్న లకు కూడా ఇదే సేవా చేయి,1
