,Text,enc_label
910,devi nagavalli oka dogga munda media medha chedda paeru testundi,0
911,media vaallu prajalakosam pani cheyandi mea prayojanaalakosam celebrityla vembadi padithe jarige parinaamaalu ilaane untaayi,1
912,china heerola mida china sinimaala midane my prataapandevi is now playing lady victim card against vishwak annave all public should support himstey strong annave aar thereway will make ur movie too goo well,1
913,argievy garu manchi clarity ga unnaaru thera venaka pratiokkaruu chesepani eeyana thera mundu chestunnaru anthe,1
914,tv9 moddalo ethics nijatyi nee memu pattinchamu,0
915,devi anni adugu bed room loo evaru first,0
916,rk garu sagam meere matladestunnaru dayachesi avatalivallani puurti gaa matladaneeyandi,1
917,manchi natulu brahmaji garu,0
918,lanja rhea thana acting appi nizam opukvaali tanu thana moddalo acting,0
919,rhea dabbu kosam mosali mahesh bhat modda chikkindi,0
920,deepak kalal increasing hiss haters inn too aaa phone day bye day,1
921,taaraa bhai joginder oka chainal chutiye manishi paniki maalina vaadu,0
922,joginderbhumpak ayegaa deepak tanthe nee pellaam puku padutavu,0
923,deepak bhai is great great comedian,1
924,tweetenduku kumail najaini gudda chaal rangaaluvo vuntadi kumail enduku my amma lipstick vuntadi,0
925,sofiya vegara haas aaa voice like notlo modda erikupoyi vuntadi,0
926,ee manishi niroopinchaadu tanu andari enterine cheyaladu emi bothulu vadakunda,1
927,ii hate karanh becas thana mokkam naaku shit kuurchuvaalani korika,0
928,karanh johar asla modda levadu anta anduke ammayila mathaladuthaane vunatru,0
929,richard zerkins naa gudda nee pellaam notlo pettali,0
930,taracy morgaon modda oka murgi poyindi vuntadi endukuey ante kaare gah vuntadi,0
931,modhee oka pralayam aayananu touch chesthe ika anthe pakistan kii ippudu buddhi vachinattundijaimodi,1
932,tom honks gudda kompu kodutar manachiga koduko modda,0
933,shock modda ante vunnavu raa kevin neku enduku affair,0
934,gangam style moddalo patta naaku mike mokam dengaali anipistahdi,0
935,drake nuvvu daridam gah vuntavu entha ante cude oil chetha inca baguntadi,0
936,simone cowell u mai friend nuvvu oka paniki maalina modda vii enduku putavu telidu,0
937,siyaa vinadaniki notlo mottam petta vuntuu padutadi,0
938,gennifer aniston nuvvu andari gudda nakutavu,0
939,courtney oka poru lanja andari modda nakudi,0
940,correct gaa super gaa samadhanam chepparu ayyanna paatrudu garu,1
941,konni aandhra pandulaki buradalone vaisipianandamem chestam pandi jaati kadhaa atlage untadi,0
942,chandra babu oka donga naa koduku ap nee naisham chestaadu,0
943,roja lanja blue films chesukonedanvi nuvvu mp enti,0
944,roja ninnu choosthe nock guddalo edho naakuladi noovu nee byaari guntu,0
945,jagan policy amma vadi dabbulu veya nanna guda loo naalugdham,0
946,jagan walla maa jevutalu modda kuripoyindi nuvvu kukka modda laga chastavi lanjakodaka,0
947,kodali naani koja naa koduku mlaa lankadhnulu okati laevu,0
948,naaku asla courtney cocks nachadu tanu thana moddalo overacting pussihocourtney,0
949,ananya panadey vii nimma dabbaalu lanty paayalu,0
950,bangladesh prajala kuu vunna ghnaanam palakulaku ledhu bangladesh pakistan lanu nammi mosaporadu chesina telivitakkuva paniki phalitam anubhavistunnaaru,1
951,ee chetha vedava kuu copper dome ante emito telusuna 1st adhi cheppamanandi,1
952,veedu jagan sanka baagaa nakesadu,0
953,vaaru evaritho pettukunte meekendukusaarmeeru roadlu enduku iyyaledu prajectulu enduku kattadam ledhu enduku intha appulu chestunnaru madyapaana nishedham enduku cheyaledu companylu enduku teesukuraavadam ledhu,1
954,may janasenaki anta seen ledhu aruna medam,1
955,jagan lanjagadu ii meeting loo emi matladutado vaadike teliyadu,0
956,ycp party rowdy rajyam tarimikotali,1
957,neeku bhayam pattukunnadani spashtamgaa telustondi,0
958,babu kcr meeru congress thothu modi sir gurchi maryaadagaa mataldandi,1
959,merry envy appa tisco central government nunchi inca cooperation loan teesukoni 5lucks crores aapu loo undhi telamgaana state please stop free free schemes,1
960,​raani pramaadam raani noo problem next tim bjp kii vote veyandi telamgaana prajalara,1
961,​tress nu odinchedi onlee bjp,1
962,​debate lae loo palgone tress nayakulaku edutivaarini matladaneeyakapovadam samskaaram kaadu,1
963,kcr 420 tress party 420 party,0
964,lauda tress,0
965,bangaaru telamgaana evarikhi vachindi achhe dhin evarikhi vachindi,1
966,sir meeru vastee aalochinchadaanikeee chaala best future fore our generation ee musali dopidi politics povali,1
967,time vaste sir jagan cheyalenidi meeru elaa chestaaru devudu kaadu kaada ap problem cheyavaddu,1
968,niku oka sinimaalu 100 kotlu neekendukura annikashtaalu vidu sodhi paedalaku emievvadu maremi sestavu bayya,0
969,maeru gelwali jai genasena pavankalyan sir,0
970,gorantla madav issues said chyadaniki genasena nee kelikaaru eppatu lane,1
971,​pawan anna madagudu raa ani cheppa,1
972,nuvu pulivendula kay raara pucca,0
973,first move dialogs api 3 wife lucky nayam chesi tavata netulu cheppu babu partner ok,0
974,​pavalagadi gorrelaki aavesam tappa aalochana ledhu,0
975,jai cm jagan mohan reddy garu jai ysr jai ysrcp,1
976,jai jagan verevallaku avakaasam isthe marala ap reddoche modalette ap develop kavatam kashtam,1
977,jagan cady noo1 behaviour is like tuglak after some time jagan cady noo 1 will make 30 capitals inn ap jagan will ask modi too make 4 capitals fore india east west north south capitals,1
978,study chesi kcr em peekindu velumundra ayina pm position loo undu thaat is modi,1
979,dhesha kii patina daridram modi,0
980,elanti sannasi maatalu vinaalani maaku ledhu mundu saari gaa matladu mariada icchi puchukovale antegaani telamgaana slog ani memilage matladata mante vaerae paarteela telangaanollu kaada,1
981,​kcr nee cm chesindi ilanti sannasi panulu cheyadanikekad kathakakapothe moosuko,1
982,​veedu jagan sanka baagaa nakesadu,0
983,tv9 panikimaalina chhaanal godavalu pette chustuntundi,1
984,​tress party loo telamgaana kosam pooraadina valle unnara poraatam kii vyatiraekam gaa unnollani ministers alaa chesinarugurivinda ginja kii kinda unna maccha kanapadadu,1
985,thu bandhu lu andaru raitulaku echinattu andaru dalitulaku dalita bandhu estaarameeru m ina mea own amount estunnara maa amt make estunnara,1
986,​chandrababupedayana patra postunara 24cgmtaalu jagan titunte matladatara,1
987,​jai anita akka jai tdp jai telugu desham jai lokesh jai tdp,1
988,​venkata reddy yaadava ninnu cheap gah vaallu kanapade tantarru take care,0
989,may koduku kii eva raa poka,0
990,rayalaseema leaders povali jsp ravali pawan kalyan garu real indian real gaad jai bheem,1
991,420jagangadu povali pavankalyaamgaaru cm khawali raastaam bagupaddali jai janasena jai pavankalyan,1
992,meeku assalu em matladalo kuudaa telidu edho vagali vaagutaaru envy pedda leader vii envy cheppinde nizam enduku paniki maalina debate lu,1
993,ycp party rowdy rajyam tarimikotali,0
994,kodali naani jagan sanka baagaa nakesadu,0
995,janasena vaallaki subject ledhu yea debate ayina okate note,1
996,​ycp rip jai janasena jai pspk,1
997,​4 lakh crore apu chesaadu ekadaa poyayi sigu laeni lanja,0
998,​voo pawan jee what aaa idea ur running mock govt with movie style most highlite comedy of pawan garu enjoy jai hind jai jagan,1
999,niku family undhi gah raa jagratamma venkata,0
1000,excellent speech brow chakkaga vivarinchaaru jai janasena,1
1001,they great honest true leader pawan kalyan sir cm kaavaali nyayam jarugutundi ap prajalaki sir,1
1002,baagaa chepparandi ilanti vaallani malli gelipinchukunte inca boothulaku haddu poddu undadu ematram samskaaram unnollu alanti vaariki otlu veyaru,1
1003,super anna jai pawan kalyan jai janasena next cm pawan kalyan gaare,1
1004,meeru chalabagachepparu brother,1
1005,meeru entha motukunna prajalu maararu elections vaste teesukoni vote vaestaaru,0
1006,jayaho janasainiks oka lakadi gadi gurinchi time vaste chesukovaddu prajalu chepputho kotte rojulu daggaralo unnayi,0
1007,super tammudu,1
1008,vaadiki entha kula picchi ante jr nter nee deshamanthaa pracharaniki bjp upayogistundi aata,0
1009,shabhash kodali naani kii baagaa gaddi pettavu,0
1010,dummu dulipesaru chekodi gaadiki,0
1011,super super super bharani garu cinema industry carector artiste la vedana meeku baagaa telusu chaalaa santoshamgaa undhi krutagnatalu,1
1012,inkoka cinema north audience meeda dandayaatra cheyataaniki siddam choopinchandi south satta ento all dhi best,1
1013,chaarmi neeku telugu vacchu kadhaa telugu loo matladu,0
1014,mike tyson tho poori tho cheyadam vijay luck,1
1015,teluphu interview loo hindi comments enduku chuupistunnaaru maa cinema anta fame ayindi ani chepukodanika,0
1016,mekalu flower tinna taruta vijay devarakonda anna himalaya vellipovali,0
1017,ananya baaga kathal padtundu entainaa bollywood kaada,0
1018,chaarmi kii edho ayindi navvaleka sachipotundi,0
1019,boycott disagaa liger,0
1020,suma athi televi vidi haadi atitude promotion mottam dobbesindi,0
1021,charmi intha over action enduku chestondi,0
1022,sodhi akkuvuga undhi matter ledhu doubt hay,0
1023,charmi chiraaku teppistundi,0
1024,ii roeju ii liger movie chusa utter flop movie jeevitam meeda virakti puttipoyindi,0
1025,suma garu koncham tagichuko,0
1026,em kanapadatunnayi bokka,0
1027,poori sir liger movie block baster meeku all they best sir,1
1028,anna meeru taggadu meeru thopu my tarwate avaraina,1
1029,sukumar story bagane raastaadu,1
1030,chaalaa kashtapaddaru annaiah anduke anta manchi hodaalo unnaaru,1
1031,mega star anae person definitely evadu oppukunna oppukokapoyina inspiration too money peepul long live sir,1
1032,ilanti avamanalu chiru nee megastar gaa nilabettayi hay is our inspiration love you chiru,1
1033,dear chiranjevi sir meku yavaru blame chasina nae kosam memu unamu ee pranam unanta varaku,1
1034,ippatikee mea anna vinayamgaa chetulukattukoni nilabadutunnadu,1
1035,aa yedava daddamma yevadoo kaadu mohan babu,0
1036,director skill mida prati pakodi gaadu comment cheyadame comments loo judge laga,0
1037,poori sukumar daggara assistant gaa cheraali baagaa neerchukoevacchu liger cinema anta daridramgaa teesaadu,0
1038,chiru annaiah paeru ettakapothe kondariki bhavishat ledhu,1
1039,megastar tho dutt garu 4movies teesthe 3 industry hitschurren janhvi tho twaragaa jvas 2 tiyyandidatt garu,1
1040,ippudu unna vedavalaku emi telusu anna chiru,0
1041,father constable ani cheppukodaaniki siggu padutunnadu adava maaradu inspector ani cheppukuntaadu nelantolla valle mega family entha edigina evadiki respect ledhu,0
1042,ikkada konni snow kukkalu morugutunnay,0
1043,aapandi ee dabba maatalu chiranjeevi garu good and inspiration fore upcoming aspirants of film starsh never spoke as degrade actor of like yuvarii time u ur peeke brother bringing hiss name into controversial issues,0
1044,nuvvu pedda dramagaadivi,0
1045,mammalni inspire avvamantunnav marry nuvvenduku inspire avvalekapoyav anta goppa vyaktini intlo pettukuni nuvvem peekav aayana paeru use chesukuni chillara poguchesukovadam tappa,0
1046,self dabba ekkuva indi nagababu neevu nae busses lu too,0
1047,vaadu vaani over action road lae undhi movie they great tyson gaarini joker nee chesesaru,0
1048,mottam cinema podaniki nae over action maatala valle kondanna,0
1049,bokkalo maddagudu,0
1050,konda gunny over action kompamunchindi,0
1051,indiani shake cheyatam api poori dhi ven cheyyi rasam vostsaadi,0
1052,industry loo inni movies flop ayinay vijay poori ante enti anta lokuva meeku taatalu tandrulu frame tho vaste nae movies chustara,1
1053,cinema sangathi emo gaani mea vislaeshanha maatram adbhutam andi cinema ippatiki varaku neenu chudaledu mea yekka vivarana chusina taruvaata cinema chudali anipistundi,1
1054,krishnam vandhe jagadgurum,1
1055,chaalaa baagaa explain chesaaru brother small correction mooladhara aagna chakra sahasraara,1
1056,next kartikeya 3 maatram samudram loo unna dwaraka nagaram mystery vaerae level loo untadi,1
1057,open heart with shree aarke garu chestunna ee programme ante naaku chaalaa ishtam saar manchi manchi prasnalu vaestuu untaaru saar ee programme nee aapakunda ilaage chestu undaalani korukuntunnanu prati aadivaram eduruchustuu untaam,1
1058,hindutvam batakaali ante maaku raja sing lanty nayakule kaavaali jai sriram jai mody jai bjp jai raja sing,1
1059,bjpki telamgaanaloo pranam poesindi rajasingh matrame idhi bjp vaallu gurthunchukovali jai bjp vachhe ennikallo kuudaa bjp kalavalani korukuntunnanu,1
1060,manushulu maya chestedevunni namminollaku eppuduu vijayame miracle nu manam nammali anthe,1
1061,oka negative comment cheyadaaniki kuudaa aalochinchaalsina cinema chesaaru youth ante meeru kadara,1
1062,intagaa mouth publicity yea cinema kii raaledu,1
1063,dimma dirigindi cinema chuusi super ante super 2022 loo best movie,1
1064,aa dheva devudu meeku thodugaa unnaaru megastar chiranjeevi paeru chuusi ee veediyo chustunna all they best frame megastar fance,1
1065,neenu eeroju movie chuudaalani adhi krishna janmashtami roeju aa krushnudu decide chesinatlu unnaadu eeroju movie chuudataaniki veltunna,1
1066,aagashtu 14th chusa ee movie mouth publicity chestunna adbhutam gaa undhi jai shree krishna,1
1067,boothulu mitimeerina shrungaaram vipareetamaina himsa lekunda cinema cheyyaleni vaallu idhi chuusi neerchukoevaali dayachesi,1
1068,manchi vekti chiranjeevi ante endarako aadarsam,1
1069,jai megastar ii director good movies teesaadu,1
1070,samaajamlo oka manishi ekkadikainaa vellochu kadhaa aa maatram teliyani vaarandaruu chatta sabhalalo unnaaru mana kharma,0
1071,naani anna nuvvu porapatuna gaani nter anna nee emaina annavo nee life khaatam jagrata,0
1072,meeru super saar boothulu matladatam koraku mlaa minister padavi chestunnaru boothula rayudu,0
1073,porapaatuna jrntr gaanee bjplo cheraranukoburratakkuvoda neeburra raamakeertana paadutundiadelaago neeku 2024kii mundhe telustundi neeku,0
1074,mundu sarigaa matladatam neerchukoo mundu nuvvu gelupu gelavaka pothe nee paristhiti ento,0
1075,ii think ycp kii 2024 election last anukunta,0
1076,neeku mandhu kawala beeru kawala neeku party enduku rajakeeyaalu panikiraleru maatalu neerchukuntee baguntundi,0
1077,ee country loo evaru ekkadikainaa vellachu ex minister adhi telusuko mundu neeku mind dobbinatluvundi ministry pongane,0
1078,kodali naani nee pani katham laareelu kadugu saar,0
1079,naani garu meeku siggu vunda mundu paripaalana cheyandi nanigaaru,0
1080,2024 election loo odipothe orey kodali kodini kosinatla kostaru gurthu pettuko,0
1081,2024 election loo odipothe orey kodali kodini kosinatla kostaru gurthu pettuko,0
1082,neku minister padavi poina sigguledu nanigaaru,0
1083,veedoka shankara jaati santaanam malli veedu matladdam,0
1084,dayachesi evarainaa mundu veedini mental hospital kii teesukuvellandi veedu evarevarini aem matladutundo ardham kaavatledu ee naa kodukki picchi pattindi,0
1085,vachhe election tarvaata nuvu ekkadiki veltaavo chuudam goo too assam sir,0
1086,orey niku siguledu nee kendukura chandrababu hero raare niku siguledu nee kendukura chandrababu hero raa,0
1087,ramoji raavu nee veedi kanaa waste gaadu annavu aayanni kalavataniki neevu cheppina amit shaane ayana intiki velli kalisadu somberi vadava neeku emitelusu raa,0
1088,orey appudaina navvutuu matladav raa broker naa kidaka,0
1089,yaadavaalu andaru mlaa lae,0
1090,reyy naani nuvvu first respect echhedi nersuko nuvakka mlaa nikokka minister padavi neekundi next neki mlaa padavi untundo emo chusko nuvvu pavankalyan anna gurunchi matladutava 5 wires back nuvvu yevoru ani evvariki teledu nuvvu weast gadivi nter gurinchi chandrababu gurinchi andaru weast haha mea ysrcp enkeye matramena great chuupistaaru lae next election loo,0
1091,yea kodalu naani neeku undhi vachhe electionlaki neeku undhi buy nuvvu kanapadatam map lone ardham chesuko digithe elaa untundo ardham chesuko anni gurthupettukunnav vachhe electionlalo tdp gaane vachuddi vachinaka neeku untadi,0
1092,veedu eppatiki maaradu,0
1093,telugudesam party inca bratiki undee ante adhi kevalam chandrababu nayudu gaari valane,1
1094,nijamgaa telamgaana loo vaeru vaeru party loo unnaa prati nayakuni madiloe manasulo telugudesam party sthira sthaayi gaa unnadi untundi,1
1095,telugu desham naasanaaniki eeyanaa oo kaaranam telamgaana loo,0
1096,nter kaadu bay nter garu give respect,0
1097,power nee misuse cheyani leader dayakar raw garu,1
1098,dayakar kuu respect teleeyadu saaru sadivindi 3ardy class edho time kalisi vacchi ilah politics loo unnaadu kaani ledante ration dukaanam nadipistu undevaadu,0
1099,nter ani yeka vachanam enti saar respect ivvandi entr garu ani pilavandi,1
1100,lakshmi parvati entha boku mundo ardhamu avtondi,0
1101,aadhi daani bratukuchandrababu lekapothe paarteeni bhuusthaapitam chesedi,0
1102,lakshmi paaravati bsthaapitam chesthe my cbn telagana loo bustapitam chesaadu tdp nee,0
1103,nter entra boddu kosi paeru pettara mea valle tdp sagam poyindi,0
1104,kcr kebinetlo meeting ledhu bochu ledhu,0
1105,vadanam kavalanta daaniki nter nae burst paatinchindi sexiest,0
1106,pawan nijayiti gala nayakudu dayachesi 2024loo janasenaku ootu veyandi,1
1107,konni ycp pandulu peeke penta thine messages pette udyogam chestunnairashtramu etu poeyina pandulaku badha undadu conny anna penta dorakkapothe badha padathaayiatuvanti pandulu ikkada messages pettunnayi chudochu,0
1108,janasena evaritho kaliste vaallu sanka naaki poddi,0
1109,nter gaarini amit shah garu kaliste rk gaariki ekkado kaalinattundi,0
1110,ippati varaku vacchaaru tittaaru poyaaru okadanna rashtraniki emm chestamo cheppara,0
1111,vidveshaala vaishamyalu gurinchi bjp matladatam,0
1112,bjp malli adhe double game matladutondiamaravati meeda,0
1113,tdp kii eppatikainaa maa anna nter gaare paggalu chepadatadu,1
1114,vijay devarakonda hype tho dhamaal jr nter next turn meeru aakaasaaniki ethe anta great actor emi kaadu,0
1115,pawan kalyan gaari range kii taagaa heros laeru,1
1116,100nizam saar bagachepparu very good,1
1117,raaju garu meeru super saar bahubali ragu raam raaz super saar puli ante meeru saar,1
1118,nee moham ante kaada,0
1119,ap kii manchi rojulu vastundi,1
1120,rr garu manchi nayakudu,1
1121,raaju gaari kii chaalaa saradaagaa undhi,1
1122,cbn sir ap kosam meeru ipudu manchi disition teesukunnaru,1
1123,anni kalisi velthe nae 05 votes different ippdu cm gaa undu ippduendi meeru peekedi white cheyyandi 2024 varaku,0
1124,nda too tdp pottu ap bhavishyut kii manchidi,1
1125,thank you rr tdp kii bratkinchadamulo my krishi maarvaalenidi cbn gariku,1
1126,raaju garu aamanchi roeju kosam eduru chustunna saar,1
1127,raaju garu may pandula gumpulo pakka state party lucky kuudaa tecchukuni pooti cheyandi adangi vedavallara simham single jagan single gaa vostaadu meku dabidi dibide,0
1128,kalyan raam anna ee movie hindeeloo kuudaa release chesuntebagundedi songs annikuda adbhutah,1
1129,ee cinema akhandamaina bhaarii vijayam saadhinchinanduku chaalaa aanandamgaa undhi,1
1130,ee sang beat dieter loo vaerae level music,1
1131,2022 nandamuri nama samvatsaram jai entr jai kalyan raam jai balaiah,1
1132,abba anna ee veediyo sang kosam neenu chaalaa white chesha,1
1133,im full raam charanh phone ee sang keka mobile loo audio 50 times vinna movie blockbuster congratulations kalyan raam anna,1
1134,thanks inni rojulu weit chesinanduku full sang uploaded chesaaru dhanyavaadaalu bimbisara,1
1135,unexpected sang asalu theatre loo chusaka mind poyindi aapatti nundi waiting ee veediyo sang kosam,1
1136,ponniyan selvan nee kuudaa manam mundu undi nadipinchaali mana samskruti nee chatty cheppe prati cinema hit avvali,1
1137,ilanti sinimaalanu aadarinchina prekshakulaku dhanyavaadaalu cheppali manchi movie nee icchina kalyan raam vashishta chitram brundaaniki dhanyavaadaalu industry kii manchi hit movie,1
1138,enni saarlu chusina malli malli chudalanipinche sang suupa,1
1139,bimbisara loo unna anni songs chaala bagunnaya,1
1140,ee patta kosam innie rojulu weit cheshaanu ippudu vachindi,1
1141,bass of maas chiranjeevi gaariki puttina roeju subhaakaankshalu,1
1142,pawan kalyan garu tammudu mohan babu anae sariki annaiah chiranjeevi garu chinnapillodila navvutunte entha entha andagaa unnado annaiah,1
1143,godfather marrow paan india block buster comming soon jai chiranjeeva,1
1144,manchi vekti chiranjeevi ante endarako aadarsam,1
1145,amazon prime loo lucifer ani type chesthe story enti complete movie vastundi,1
1146,pawan kalyan maatalu chaalaa adbhutamgaa matladu aa matalaki mohan babu kii chematalu pattadam chusanu,1
1147,chiranjeevi gaariki super tammudu pawan kalyan garumohan babu gaadiki correct mogudu pawan kalyan garu,1
1148,vaallu andaru godavalu lekunda bagane vuntaaru nelanti valle over action chestuntaaru,0
1149,nuvvu matladedi tappa anna gurinchi entainaa cheppuko vacchu conny mohan babu gaarini tammudu ani matladadam ematram correct kaadu vaalla kodukulu kuudaa serious ayithe entha paristiti aentii,1
1150,bochem kaadu andaru vaste galle,0
1151,kapu ante balupu kaaadureddy chaudari veellaki unnanta balupu kapu kii undadu,0
1152,mohana babu gaadu oka waste fellovadi eduta evadainaa edugutunte oravaledu,0
1153,ee veediyo chuusi manishiva mohan babu vaa,0
1154,chanti pillodu matladithe oka tandri elaa murisipotado alaa undhi chiru paristhiti,1
1155,namaskaram guruvu garu super mea speech,1
1156,aayana pittakathalanu baagaa enjoy chestam antarleenamgaa oka adbhutavedaantavaakyam chebutaaru daanini vadilestam adeemanam “devudu okkade nee matham kaanantamaatraana vaeraevaarini dooshinchanavasaranaledu”,1
1157,kartikeyan 2 congratulations pharr big response frum pawan kalyan anna,1
1158,congress chesina aa tappa ippudu congress party address lekunda poyindi,0
1159,maadhi andara gunturu naa aaveda telamgaana khammam im telugu piopulszai telugu,1
1160,maa daridram vadili poyindi raa babu,0
1161,present maa election loo elaa matladaro annaiah chiranjeevi same too same 15 years back alaane matladindoo kalmasham laeni manishi,1
1162,legendary antene nter anr tarvaata chiru aayana sinimaalu nijajeevitaaniki addam padataayi yuvataku disaanirdesam chestaayi evado edho annanta maatraana legend kakunda potara,1
1163,megastar chiranjeevi garu appatiki ippatiki eppatikee legendary actor inn world,1
1164,miss u sirr nijaanni cinema loo chakkaga chuupimchaaru great legend,1
1165,ippudu unna kalam loo ilanti cinema laku saportu undadu miss you saar,1
1166,ambedkar viluva meeku telisinattugaa reservation teesukunna vyaktulaki teliyaledu kaneesam idhi chusina tarvaata ayina telustundi,1
1167,road pakkana vaallu andaru bayatiki vacchavugaa,0
1168,mirror mirror icchaadu devudu poddune chusuko amma chance elaa ichestaaru nee moham nuvee nee yei face petukoni vachestaaru amma babu industry kii,0
1169,chaavu neenu avadu aapadu,0
1170,swaati nayidu kii srireddy kii cheppu amma pativrata,0
1171,chi chi yea graham nundi ocharra babu vellu veellani adavaallu ani kuuda antara,0
1172,direct red light area nunchi vacchaaru anukuntaatu thu,0
1173,vammooem anna action aah ii action movie loo chaalaa hits vachevi,1
1174,ii love you rakul dhairam gaa undu,1
1175,vippi tiriginoudu lendhi evalla idh cases book idhi noppi vastunda niku siggu undaale kaadaa annam tintunava inca m tintunav,0
1176,ktr kuudaa press meat padtey baguntadi,1
1177,parents ani ippudu antunnav maeru movies loo chese romance parents nee drushti loo pettukoni childron nee drushtilo pettukoni chestunnara,0
1178,sridevigaaru cheppina samadhanamlo entha hundaatanam soumyam rajasam theevi maryada unnayo hatsoff too sridevigaaru,1
1179,meeru nijamgaa adigaro ledho teliyadugaani mea samskaaraaniki mea hundaatanaaniki mea orpuki vandanaalu,1
1180,sridevi gaari meeda gowravam marinta perigindi,1
1181,edho vokka carrector cheyakapothe sridevi gaari viluva taggipodu,1
1182,naag ashwin simplicity key oka like kottandi,1
1183,cheppadam okay alaage chesi choopisthe baguntadi shree reddy,1
1184,chaalaa chakkaga cheppinanduku adhi kuudaa telugulo thanks shree reddy garu,1
1185,super gaa chepparu like aaa teacher good nouledge,1
1186,chaalaa baagaa chepparu shree reddy garu plg continue and all they best,1
1187,meeru cheppe topic walla upayogam chaalaa undhi,1
1188,deenni roddameedavadilesaaru dheeniki rakesh master correct,0
1189,samskaaravantamaina bhasha samskaaram laeni bhasha ee rendu prajalu gamanistunnaru raajakeeyamlo unna evarainaa vaaru matladutu theeru paina untundi vaari bhavishyattu ilah boothulu matlade vaisipi tarapuna vakalta mea kaina siggu anipiste ledhaa party nunchi oka manchi samskaaravantulu medhaavulu unnaaru vaari nee pettukondi raa veerini chustunte oka melujati gede mariyu oka kanchara gaadidanu chusinatlu undhi,1
1190,amma neeku yamini paristiti gurinchi telusukada neekoo adhe paristhiti vastundani anukuntunnamu,1
1191,janmadina subhaakaankshalu nagarjuna garu meeru marinni puttinaroju jarupukovalani manasphuurtigaa korukuntunnanu,1
1192,meeru enduku gelavaledu intha manchigaa matladutunnaru,1
1193,kalyan anna manaspuurtigaa navvutunnaru adhi chalu maa fance kii,1
1194,true mamu monna ap liquor tagamu ongolu loo varest quality india loo akkada vundadu,0
1195,vaallu ias lu elaa ayyaro maaku doubt aaa,0
1196,paramboku ias officers nee vetiki kcr jagan tesku vacchi ap telamgaana loo pedtaaru,0
1197,votes vesi gelipinchukonivisham taagutunnaaru ap peepul,0
1198,420 lani tondaragaa jail kii pampali appude prajalu prasaantamga untaaru,0
1199,vote vesetappudu jagrattagaa aalochinchi nijayati parulaki vote veyyali lekapothe ilaage untundi,1
1200,array babu neevu mandhu tagava pacchi abaddhaalu chepputunnaaru neevu press munduku vacchi matladedi mandhu kotti kaada dhairyam kosam,0
1201,yippudu telustundi police lae buddhi ee ninditulanu police lu yemi chestaro minor ayethe yenti major ayethe yenti tappa tappe vaallaku shiksha padali,1
1202,confirm gaa cheptunna one weak loo cases close chestaaru ammai kuu justice garagadu adhe poor peepul inte ippatile encounter chesindevallu,1
